[
  {
    "date_display": "10/29/2025",
    "date_iso": "2025-10-29",
    "title": "Autumn 2025 Margo's News",
    "description": "Posted on the Community Bulletin Board, and printed for distribution.",
    "type": "document",
    "row_class": "",
    "page_url": "",
    "file_url": "./imgz1760/10292025_MMMnews/10292025_MMMnews_en.pdf"
  },
  {
    "date_display": "10/09/2025",
    "date_iso": "2025-10-09",
    "title": "October 2025 Margo's News",
    "description": "Posted on the Community Bulletin Board and displayed for pickup.",
    "type": "document",
    "row_class": "",
    "page_url": "",
    "file_url": "./imgz1760/10092025_MMMnews/10092025_MMMnews.pdf"
  },
  {
    "id": "2025-09-16_september-2025-mcnulty-s-news-mcnulty-contracts-her-company",
    "date_display": "09/16/2025",
    "date_iso": "2025-09-16",
    "title": "September 2025 McNulty's News: McNulty Contracts Her Company",
    "page_url": "./imgz1760/09162025_MMMRCAhack/09162025_MMMRCAhack.pdf",
    "description": "McNulty's Residents Council of Advisors  ~~~~~~~~~~strong>was not democratically chosen ~~~~~~~~~~/strong> to represent the People of 1760 Bush. McNulty just made it happen by publishing with a header in the newsletter.",
    "file_url": "./imgz1760/09162025_MMMRCAhack/09162025_MMMRCAhack.pdf",
    "row_class": "alert alert-danger",
    "type": "document"
  },
  {
    "id": "2025-05-27_may-2025-margo-s-news",
    "date_display": "05/27/2025",
    "date_iso": "2025-05-27",
    "title": "May 2025 Margo's News",
    "page_url": "./imgz1760/05272025_MMMnews/05272025_MMMnews.pdf",
    "description": "Posted on the Community Bulletin Board, which McNulty controls access to.",
    "file_url": "./imgz1760/05272025_MMMnews/05272025_MMMnews.pdf",
    "row_class": null,
    "type": "document"
  },
  {
    "id": "2025-04-07_mcnulty-visits-rittenburg",
    "date_display": "04/07/2025",
    "date_iso": "2025-04-07",
    "title": "McNulty visits Rittenburg",
    "page_url": null,
    "description": "After McNulty was granted a RO, she taunts Rittenburg with a visit and a note.",
    "file_url": "./imgz1760/04072025_MMMvisit412/04072025_MMMvisit412.pdf",
    "row_class": null,
    "type": "document"
  },
  {
    "id": "2025-02-06_1760-tenant-association-bylaws",
    "date_display": "02/06/2025",
    "date_iso": "2025-02-06",
    "title": "1760 Tenant Association ByLaws",
    "page_url": null,
    "description": "Posted next to the Community Bulletin Board. These Bylaws are the copy of 1760 Bush Street Bylaws in the office of Helen Hale . Thank you Helen Hale for sending a copy over.",
    "file_url": "./imgz1760/bylawsDoor02062025/02062025_BylawsDoor.pdf",
    "row_class": null,
    "type": "document"
  },
  {
    "id": "2025-02-05_newsletter",
    "date_display": "02/05/2025",
    "date_iso": "2025-02-05",
    "title": "Newsletter",
    "page_url": null,
    "description": "Posted by McNulty in the community case in the Lobby.",
    "file_url": "./imgz1760/02052025_MMMnews/02052025_MMMnews.pdf",
    "row_class": null,
    "type": "document"
  },
  {
    "id": "2025-01-05_board-increases-stipend",
    "date_display": "01/05/2025",
    "date_iso": "2025-01-05",
    "title": "Board Increases Stipend",
    "page_url": null,
    "description": "In violation of the Bylaws posted by McNulty on May 28, 2024 during the Nomination-themed meeting, Artile 9.11 the Officers voted to raise their stipend from $40 to $50 TA President is paid monthly [approximately]: $50 Stipend $100 Phone $60 \"Transportation\" or cab & car rides $210 per month minimum for McNulty",
    "file_url": "./imgz1760/bylaws05282024/05282024_MMMbylaws.pdf",
    "row_class": "alert alert-warning",
    "type": "document"
  },
  {
    "id": "2024-10-21_online-version",
    "date_display": "10/21/2024",
    "date_iso": "2024-10-21",
    "title": "Online Version",
    "page_url": "./imgz1760/10212024_MMMnewsJJ/10212024_news.html",
    "description": "After returning from Amazon Studios, your loving president posted this newsletter about her time there.",
    "file_url": "./imgz1760/10212024_MMMnewsJJ/10212024_news.html",
    "row_class": "alert alert-warning",
    "type": "webpage"
  },
  {
    "id": "2024-10-01_2024mmm-pdf",
    "date_display": "10/01/2024",
    "date_iso": "2024-10-01",
    "title": "2024MMM.pdf",
    "page_url": "./NOMfeedback052024.html",
    "description": "A large PDF detailing the events of the nomination and election called by the TA president and conducted by a non-Independent Third Party in 2024. Chinese, Ukrainian, Russian, and Spanish",
    "file_url": "./NOMfeedback052024.html",
    "row_class": null,
    "type": "webpage"
  },
  {
    "id": "2024-09-23_september-23-2024-mcnulty-s-news",
    "date_display": "09/23/2024",
    "date_iso": "2024-09-23",
    "title": "September 23, 2024 McNulty's News",
    "page_url": "./imgz1760/09232024_NEWSgarden/09232024_MMMnewsGarden.pdf",
    "description": "Posted on the Community Bulletin Board, which McNulty controls access to.",
    "file_url": "./imgz1760/09232024_NEWSgarden/09232024_MMMnewsGarden.pdf",
    "row_class": null,
    "type": "document"
  },
  {
    "id": "2024-07-11_07112024-letter-jpg",
    "date_display": "07/11/2024",
    "date_iso": "2024-07-11",
    "title": "07112024_letter.jpg",
    "page_url": null,
    "description": "1760 TA Board Secretary's response to the Notice of Irregular Elections Letter is still glued to Angel's door #412",
    "file_url": "./imgz1760/STUFFyouNEEDtoKNOW/07112024_letter.jpg",
    "row_class": "alert alert-danger",
    "type": "document"
  },
  {
    "id": "2024-07-05_07052024-mmresponse-pdf",
    "date_display": "07/05/2024",
    "date_iso": "2024-07-05",
    "title": "07052024_MMresponse.pdf",
    "page_url": "./imgz1760/07032024_TENANTSrespond/0703252024_election.pdf",
    "description": "Margo's response to the Notice of Irregular Elections",
    "file_url": "./imgz1760/07032024_TENANTSrespond/0703252024_election.pdf",
    "row_class": "alert alert-danger",
    "type": "document"
  },
  {
    "date_display": "07/03/2024",
    "date_iso": "2024-07-03",
    "title": "Notice of Irregular Nomination & Election",
    "description": "Irregular election conducted; CFR and due-process concerns documented.",
    "type": "document",
    "row_class": "alert alert-danger",
    "page_url": "",
    "file_url": "./imgz1760/07032024_TENANTSrespond/0703252024_election.pdf"
  },
  {
    "id": "2024-07-03_07032024-election-pdf",
    "date_display": "07/03/2024",
    "date_iso": "2024-07-03",
    "title": "07032024_election.pdf",
    "page_url": "./imgz1760/07032024_TENANTSrespond/0703252024_election.pdf",
    "description": "Irregular \"Election\" conducted This file details the alledged five violations of the Code of Federal Regulations concerning the May general meeting. Sgt at Arms Michelle organized Tenants and this Notice of Irregular Nomination & Election document was created. A large PDF detailing the events of the nomination and election called by the TA president and conducted by a non-Independent Third Party in 2024. Chinese, Ukrainian, Russian, and Spanish",
    "file_url": "./imgz1760/05142024/05282024_election.pdf",
    "row_class": "alert alert-danger",
    "type": "document"
  },
  {
    "id": "2024-06-29_ta-president-fires-treasurer-rittenbug",
    "date_display": "06/29/2024",
    "date_iso": "2024-06-29",
    "title": "TA President \"fires\" Treasurer Rittenbug",
    "page_url": "./imgz1760/06292024_MMMresponse/06292024MMMfireAR.pdf",
    "description": "Margo \"removed\" Angel before the Board meeting were Angel can make a statement & Tenants could decide on how to proceed. Margo removes Angel without due process or cause. Speaking up about the \"nomination\" & \"election\" process is Free Speech and 100% American. Look it up. Margo appears to not respect Robert's Rules of Order Margo disregards the Tenants vote, a clear sign she wants only her \"loyal supporters\" on the Board.",
    "file_url": "./imgz1760/06292024_MMMresponse/06292024MMMfireAR.pdf",
    "row_class": null,
    "type": "webpage"
  },
  {
    "id": "2024-06-25_06252024-01-jpg",
    "date_display": "06/25/2024",
    "date_iso": "2024-06-25",
    "title": "06252024-01.jpg",
    "page_url": "./imgz1760/06252024election/06262024-01.jpg",
    "description": "Margo - not the independent third party - posted \"election\" results Margo removes Angel without due process Tenants Vote Disregarded , a clear sign the president of the board needs to be held accountable. .",
    "file_url": "./imgz1760/06252024election/06262024-01.jpg",
    "row_class": "alert alert-danger",
    "type": "document"
  },
  {
    "id": "2024-06-25_an-election-themed-meeting",
    "date_display": "06/25/2024",
    "date_iso": "2024-06-25",
    "title": "An Election Themed Meeting",
    "page_url": null,
    "description": "Election-themed meeting held by Margo Here is how it was conducted and what makes it Irregular",
    "file_url": null,
    "row_class": "alert alert-danger",
    "type": "document"
  },
  {
    "id": "2024-06-08_06082024-mmmnominees-pdf",
    "date_display": "06/08/2024",
    "date_iso": "2024-06-08",
    "title": "06082024_MMMnominees.pdf",
    "page_url": "./imgz1760/05282024_nomination/05282024_MMMnominees_OCR.pdf",
    "description": "Nominees List B posted by McNulty",
    "file_url": "./imgz1760/05282024_nomination/05282024_MMMnominees_OCR.pdf",
    "row_class": "alert alert-danger",
    "type": "document"
  },
  {
    "id": "2024-05-29_05292024-mmmwendell-pdf",
    "date_display": "05/29/2024",
    "date_iso": "2024-05-29",
    "title": "05292024_MMMwendell.pdf",
    "page_url": "./imgz1760/05292024_MMMaddin/JPG_05292024_MMMwindellEN.pdf",
    "description": "Margo admits to adding 2 nominations after the meeting Margo is Stacking the Board. Visit this page and get the facts about what happened .",
    "file_url": "./imgz1760/05292024_MMMaddin/JPG_05292024_MMMwindellEN.pdf",
    "row_class": "alert alert-danger",
    "type": "document"
  },
  {
    "id": "2024-05-29_05292024-mmmmichelle-02-pdf",
    "date_display": "05/29/2024",
    "date_iso": "2024-05-29",
    "title": "05292024_MMMMichelle_02.pdf",
    "page_url": "./imgz1760/05292024_MMMaddin/05292024_MMMmichelleNoteEN.pdf",
    "description": "Margo leaves Michelle a strange letter Michelle does not understand what Margo is referring to in the letter .",
    "file_url": "./imgz1760/05292024_MMMaddin/05292024_MMMmichelleNoteEN.pdf",
    "row_class": "alert alert-danger",
    "type": "document"
  },
  {
    "id": "2024-05-28_1760-bylaws",
    "date_display": "05/28/2024",
    "date_iso": "2024-05-28",
    "title": "1760 Bylaws",
    "page_url": "./TAdocs/1760_Bylaw.html",
    "description": "McNulty presented one version to CCSD and another version displayed for Tenants in a locked case outside of the meeeting",
    "file_url": "./TAdocs/1760_Bylaw.html",
    "row_class": null,
    "type": "webpage"
  },
  {
    "id": "2024-05-28_05282024-mmmnominees-pdf",
    "date_display": "05/28/2024",
    "date_iso": "2024-05-28",
    "title": "05282024_MMMnominees.pdf",
    "page_url": "./imgz1760/05282024_nomination/05282024_MMMnominees.pdf",
    "description": "First Group of nominees posted by Margo, not the \"Independent Party\" Margo contracted independently from the Board",
    "file_url": "./imgz1760/05282024_nomination/05282024_MMMnominees.pdf",
    "row_class": "alert alert-danger",
    "type": "document"
  },
  {
    "id": "2024-05-28_05282024-nomination-pdf",
    "date_display": "05/28/2024",
    "date_iso": "2024-05-28",
    "title": "NOMfeedback052024.html",
    "page_url": "https://wtpo1760.github.io/wtp/NOMfeedback052024.html",
    "description": "Nomination-themed meeting goes poorly. The page linked is a comprehensive report of the events of the meeting. Visit this page and get the facts about what happened.",
    "file_url": "https://wtpo1760.github.io/wtp/NOMfeedback052024.html",
    "row_class": "alert alert-danger",
    "type": "webpage"
  },
  {
    "id": "2024-05-25_05252024-mmmhappymemday-jpg",
    "date_display": "05/25/2024",
    "date_iso": "2024-05-25",
    "title": "05252024_MMMHappyMemDay.jpg",
    "page_url": ./imgz1760/05252024_MMMHappyMemDay.jpg,
    "description": "To honor this country's fallen soldiers and the end of Bikini Season, Margo will host a Pizza & Cake & Song Party",
    "file_url": "./imgz1760/05252024_MMMHappyMemDay.jpg",
    "row_class": null,
    "type": "image"
  },
  {
    "id": "2024-05-24_05242024-mmmnegativity-pdf",
    "date_display": "05/24/2024",
    "date_iso": "2024-05-24",
    "title": "05242024_MMMnegativity.pdf",
    "page_url": "./imgz1760/05242024_MMMnegativity/05242024_MMMnegativity.jpg",
    "description": "McNulty speaks against her critics.",
    "file_url": "./imgz1760/05242024_MMMnegativity/05242024_MMMnegativity.jpg",
    "row_class": "alert alert-danger",
    "type": "image"
  },
  {
    "id": "2024-05-23_05232024-mmmsuper-pdf",
    "date_display": "05/23/2024",
    "date_iso": "2024-05-23",
    "title": "05232024_MMMsuper.pdf",
    "page_url": "./imgz1760/05232024_ultimate/05232024_MMMsuper.pdf",
    "description": "Margo wrongly believes she is The Ultimate Authority of the 1760 Tenant Association. SHE IS NOT the \"governing body\" of any Board. The whole concept of a Board is to ensure there are multiple voices and interests represented within an organization. Visit Page 3 of this document to learn what Margo thinks her role is .",
    "file_url": "./imgz1760/05232024_ultimate/05232024_MMMsuper.pdf",
    "row_class": "alert alert-danger",
    "type": "document"
  },
  {
    "id": "2024-05-22_mcnulty-s-public-response-to-ccs-d-recall",
    "date_display": "05/22/2024",
    "date_iso": "2024-05-22",
    "title": "McNulty's Public Response to CCS/D Recall",
    "page_url": "./imgz1760/05222024_MMMnews/05222024_MMMresponseCCSDRECALL_en.pdf",
    "description": "Margo's version of events leading up to McNulty Recalled as CCSD President in Q1 2024 .",
    "file_url": "./imgz1760/05222024MMMnews.html",
    "row_class": "./imgz1760/05222024_MMMnews/05222024_MMMresponseCCSDRECALL_en.pdf",
    "type": "document"
  },
  {
    "id": "2024-05-19_05-19-2024-ar-mm-text-pdf",
    "date_display": "05/19/2024",
    "date_iso": "2024-05-19",
    "title": "05/19/2024-AR-MM-text.pdf",
    "page_url": "./imgz1760/05142024/index.html",
    "description": "Margo and Angel text messages This helps clarify how Margo views her role, her RCA project, and what it means to be an accountable public official. Let's Check the Facts",
    "file_url": "./imgz1760/05192024_AR-MMtexts/05192024-AR-MM-text-01.pdf",
    "row_class": "05/19/2024-AR-MM-text.pdf",
    "type": "document"
  },
  {
    "id": "2024-05-15_05152024deartenant-jpg",
    "date_display": "05/15/2024",
    "date_iso": "2024-05-15",
    "title": "05152024dearTenant.jpg",
    "page_url": "./imgz1760/05152024_MMMconfusionNEWS/05152024dearTenant.jpg",
    "description": "Can it be true? Let's Check the Facts",
    "file_url": "./imgz1760/05152024_MMMconfusionNEWS/05152024dearTenant.jpg",
    "row_class": null,
    "type": "document"
  },
  {
    "id": "2024-05-14_text-between-board-members",
    "date_display": "05/14/2024",
    "date_iso": "2024-05-14",
    "title": "Text between Board members",
    "page_url": "./imgz1760/05142024/05142024-all.pdf",
    "description": "DISCLAIMER: These messages are between the Tenant Association President and the TA Treasurer on a phone paid for by the residents of the building. These conversations center around tenants rights and are available here for public viewing.",
    "file_url": "./imgz1760/05142024/05142024-all.pdf",
    "row_class": "alert alert-warning",
    "type": "document"
  },
  {
    "id": "2024-05-14_05142024-pdf-disregard-of-brown-act-breach-of-decorum",
    "date_display": "05/14/2024",
    "date_iso": "2024-05-14",
    "title": "05142024.pdf Disregard of Brown Act Breach of Decorum",
    "page_url": null,
    "description": "Irregular Nomination & Election flier posted Angel & Margo texts regarding the short notice Margo delivers inflamatory text to Angel [how would you react?] Margo dismisses Brown Act, Code of Federal Regulations and Your Right to a free and fair election",
    "file_url": "./imgz1760/05142024/05142024-964-420.pdf",
    "row_class": "alert alert-danger",
    "type": "document"
  },
  {
    "id": "2024-04-04_hoc-april-4-2024-meeting-minutes-adopted-pdf",
    "date_display": "04/04/2024",
    "date_iso": "2023-04-04",
    "title": "HOC-April-4-2024-Meeting-Minutes-Adopted.pdf",
    "page_url": "https://www.youtube.com/embed/9TBbgo7vPJU",
    "description": "Margaret McNulty is appointed to Seat 11, Board on the Local Homeless Coordinating Board of the Homeless Oversight Committee [LINK: https://www.sf.gov/departments--homelessness-oversight-commission] Here is a link to McNulty's appointment to Seat 11 of the Local Homeless Coordinating Board, Seat 11. McNulty's self-introduction to the Homeless Oversight Commission at the April 2024 meeting. Please feel free to contact the Local Homeless Coordinating Board to verify this information at (415) 705-5555.",
    "file_url": "https://www.youtube.com/embed/9TBbgo7vPJU",
    "row_class": null,
    "type": "Video"
  },
  {
    "id": "08/00/2024_2024mmm-pdf-english-version",
    "date_display": "08/00/2024",
    "date_iso": null,
    "title": "2024MMM.pdf [English version]",
    "page_url": "./imgz1760/infoCH/2024MMM.pdf",
    "description": "A large PDF detailing the events of the nomination and election called by the TA president and conducted by a non-Independent Third Party in 2024.",
    "file_url": "./imgz1760/infoCH/2024MMM.pdf",
    "row_class": "alert alert-info",
    "type": "document"
  },
  {
    "id": "00/00/2024_2024mmm-pdf",
    "date_display": "00/00/2024",
    "date_iso": null,
    "title": "2024MMM.pdf",
    "page_url": null,
    "description": "A large PDF detailing the events of the nomination and election called by the TA president and conducted by a non-Independent Third Party in 2024.",
    "file_url": null,
    "row_class": null,
    "type": "document"
  }
]
